Class Index,Title,Description
4,Thomson joins takeover bid for ContentGuard - Analysis,Thomson joined Microsoft and Time Warner on Monday in trying to take control of U.S. digital rights management (DRM) company ContentGuard Holdings. This report summarizes recent developments and background context.
3,Auto sales rise; Asians gain share - Analysis,Consumers shrugged off higher gasoline prices and weaker economic conditions to lift new car and truck sales up 2.2 percent in October. This report summarizes recent developments and background context.
3,"Thanks for the Pageviews, Ivan - Analysis",Bad weather has been very good for business at Weather.com and other popular forecasting sites. They are posting record traffic in the wake of Hurricane Ivan's arrival on the mainland. By Joanna Glasner. This report summarizes recent developments and background context.
2,Hayden walks into strife - Analysis,Spirit of Australia was on the skids last night after another example of double standards by the home side marred the opening day of the second cricket test against New Zealand in Adelaide. This report summarizes recent developments and background context.
1,Telescope snaps distant 'planet' - Analysis,The first direct image of a planet circling another star may have been obtained by a US-European team of astronomers. This report summarizes recent developments and background context.
2,"Upstarts Guatemala, Panama Face Crunch Qualifiers - Analysis", RIO DE JANEIRO (Reuters) - Upstarts Guatemala and Panama  face crunch matches against more experienced CONCACAF opponents  Saturday as they continue their quest to qualify for a first  World Cup. This report summarizes recent developments and background context.
4,US Spacecraft to Probe Origin of Gamma Rays Far Beyond Our Galaxy - Analysis,"The US space agency, NASA, launched a satellite Saturday that scientists hope will help them locate the sources of mysterious gamma ray explosions, the  This report summarizes recent developments and background context."
4,"Recording Industry, File-Share Face Off - Analysis",The next chapter in the global legal battle between the recording industry and file-sharing services is due to unfold here Monday when the owners of the hugely popular Kazaa software go on trial on civil copyright infringement charges. This report summarizes recent developments and background context.
1,"Moscow Rail Station Evacuated on Bomb Threat, Interfax Says - Analysis",Moscow police are conducting a partial evacuation at the Kursk railway station in central Moscow as they search for explosives after receiving an anonymous phone call from a man threatening  This report summarizes recent developments and background context.
1,3 UN staff kidnapped in Afghan capital - Analysis,"Unknown armed men in military uniform kidnapped three staff of the United Nations in the Afghan capital city at broad daylight Thursday, Afghan officials confirmed. This report summarizes recent developments and background context."
4,Avaya to buy German IP telephony vendor - Analysis,"U.S. telecommunications equipment maker Avaya Inc. increased its presence in Europe to the tune of about \$635 million on Tuesday, agreeing to acquire German enterprise communications vendor Tenovis GmbH   Co. KG. This report summarizes recent developments and background context."
4,Star Wars Battlefront; Sly 2: Band of Thieves; MacFamily Tree 4.0.6 - Analysis,"Hearing a Jar Jar Binks-lookalike Gungan yell ""Meesa gonna die!"" as my droid tank shot him point-blank may have been the best part of this game. This report summarizes recent developments and background context."
2,Jaguar Exit Throws F1 Deeper Into Turmoil - Analysis," LONDON (Reuters) - Formula One, already struggling to shape  its future and put on a show, is staring into the abyss after  Ford's decision to pull out and sell its Jaguar team. This report summarizes recent developments and background context."
3,Continental won #39;t make pension contributions this year - Analysis,"Continental Airlines announced today it will not make any contributions to its pension plan this year, citing as reasons the ongoing uncertainty of the industry #39;s economic environment and the record high cost of jet fuel. This report summarizes recent developments and background context."
2,Sloppy win suits Badgers - Analysis,"TUCSON -- Booker Stanley ran for a career-high 135 yards on 30 carries, including a 7-yard run for Wisconsin's only touchdown, and the 20th-ranked Badgers rallied for a stormy 9-7 victory over Arizona yesterday. This report summarizes recent developments and background context."
2,Barcelona crush Malaga 4-0 - Analysis,"MADRID, Dec. 5. - Samuel Etoo scored twice to help FC Barcelona beat Malaga 4-0 and extend its lead in the Spanish league to 10 points. This report summarizes recent developments and background context."
3,More buyers choose artificial - Analysis,"Renee McDonald remembers the Christmas trees of her youth: spindly, fake and out of a box. They were hard to put up, and they just didn #39;t smell right. This report summarizes recent developments and background context."
1,Italian PM #39;s transplant confirmed - Analysis,"After days of speculation sparked by the white bandanna worn by Mr Berlusconi on holiday in Sardinia, Piero Rosati said the results of the operation would show in a couple of months. This report summarizes recent developments and background context."
2,"Gray, Demon Deacons Swing Back In Action, Seek To Shoot Down &lt;b&gt;...&lt;/b&gt; - Analysis",Justin Gray has had an ample amount of time to get his shooting stroke ready. Gray and No. 6 Wake Forest are back in action after an eight-day break when they visit Temple on Monday. This report summarizes recent developments and background context.
3,Wal-Mart Keeps Its September Sales View - Analysis,"Wal-Mart Stores Inc. (WMT.N: Quote, Profile, Research) on Monday maintained its September sales forecast and said back-to-school demand picked up for key categories including electronics and clothing after a sluggish start. This report summarizes recent developments and background context."
1,Kidnapped Italian freed in southern Philippines (AFP) - Analysis,"AFP - An Italian aid worker walked free from the southern Philippines jungle, a day after he was abducted by local gunmen. This report summarizes recent developments and background context."
1,Terreblanche challenges SA arrest - Analysis,White supremacist Eugene Terreblanche is detained after allegedly breaking the terms of his parole. This report summarizes recent developments and background context.
4,"Quicken, Money Duel to a Draw (washingtonpost.com) - Analysis",washingtonpost.com - The Intuit-Microsoft battle for supremacy in the personal-finance software market is as long-running as some sports rivalries -- except that few users seem to care all that much about the outcome of this contest. This report summarizes recent developments and background context.
3,SBC and Yahoo! extend pact to offer Internet service - Analysis,"SAN ANTONIO SBC Communications and Yahoo are expanding their high-speed Internet service partnership to link video, wireless phone, Internet and other services. This report summarizes recent developments and background context."
4,Seagate to Ship 400 GB HDD - Analysis,SL: Seagate Technology has announced that it will begin shipping the world #39;s highest capacity PC hard drive to retail stores and resellers. This report summarizes recent developments and background context.
4,MSN Messenger difficulties - Virus - Analysis,"People using Microsoft #39;s instant-messaging software, MSN Messenger, may have been a mite lonely this weekend, with only a virus to keep them company. This report summarizes recent developments and background context."
1,"A perfect storm of political peril, unless... - Analysis","The extended train wreck that has been American-dominated Iraq is winding its way toward a decisive intersection: the national elections scheduled for Jan. 30, 2005, where voters will be asked  This report summarizes recent developments and background context."
3,Alaskan pipeline has hurdles - Analysis,Energy companies planning a \$20 billion gas pipeline to US consuming markets from Alaska welcomed new federal loan guarantees but cautioned Tuesday that other issues must be resolved before the huge project proceeds. This report summarizes recent developments and background context.
1,Israeli tank reportedly kills Egyptian troops - Analysis,"An Israeli tank has opened fire and killed three Egyptian troops on the sensitive border between the two countries, mistaking them for Palestinian militants on the way to carry out an attack, Israeli media says. This report summarizes recent developments and background context."
3,"CBOE to sell stake in National exchange, buy CBOT rights - Analysis",The Chicago Board Options Exchange said Tuesday its directors approved steps to reduce its financial ties to two other exchanges in town. This report summarizes recent developments and background context.
3,Concerns About Winter Push Oil to Record - Analysis, SINGAPORE (Reuters) - Oil prices broke into new record  territory above \$52 Thursday on heightened concerns that  supplies of heating fuels will prove inadequate during the  northern hemisphere winter. This report summarizes recent developments and background context.
1,"Chechens Vote for New Leader, 'Bomber' Kills Self - Analysis"," ZNAMENSKOYE, Russia (Reuters) - Chechens voted Sunday for a  new president in a tense election, but many doubted the  Moscow-backed police officer who was set to win would manage to  stamp out rebellion in the turbulent region. This report summarizes recent developments and background context."
1,Sudan vows to restore order to Darfur but calls for African peacekeepers (AFP) - Analysis,"AFP - Sudan will take the lead in restoring order to its rebellious Darfur region but needs the support of African peacekeepers and humanitarian aid, Foreign Minister Mustafa Osman Ismail said. This report summarizes recent developments and background context."
3,"DreamWorks, Pixar rule digital animation - Analysis","DreamWorks and Pixar both make cutting-edge digital animated films. But behind the scenes, the two studios are about as different as Shrek and Mr. This report summarizes recent developments and background context."
2,Islamic threaten women #39;s soccer tournament in Bangladesh - Analysis,The organizers of Bangladesh #39;s first women #39;s soccer tournament promised to keep playing despite protests by a Muslim group that called the event  quot;indecent and against Islamic norms quot;. This report summarizes recent developments and background context.
1,Afghan court convicts US trio of torture - Analysis,"KABUL, Afghanistan -- Three Americans -- led by a former Green Beret who boasted he had Pentagon support -- were found guilty yesterday of torturing Afghans in a private jail and were sentenced to prison. This report summarizes recent developments and background context."
3,"Multiplex, Westfield in UK bid - Analysis",SHOPPING centre giant Westfield Group has drafted rival Multiplex and the billionaire Reuben brothers into its pound stg. 585 million (\$1. This report summarizes recent developments and background context.
1,Romania Faces Hung Parliament Risk After Vote - Analysis," BUCHAREST (Reuters) - Romania faced weeks of uncertainty on  Monday after inconclusive general elections in the poor Balkan  country, already struggling to stay on track to join the  European Union.  Partial results showed the ruling ex-communist Social Democrats  (PSD) of Prime Minister Adrian Nastase a whisker ahead of the  opposition centrists in Sunday's election but well short of a  majority in parliament. This report summarizes recent developments and background context."
3,"Update 1: Toshiba, TCL to Cooperate on Appliances - Analysis","Focusing on the fast-growing Chinese market, Japan #39;s Toshiba and major Chinese appliance maker TCL have signed a broad agreement to cooperate in making and marketing appliances in China, the companies said Thursday. This report summarizes recent developments and background context."
4,Baby for ovary transplant woman - Analysis,A Belgian cancer patient made infertile by chemotherapy has given birth following revolutionary treatment. This report summarizes recent developments and background context.
1,Israeli tank reportedly kills Egyptian troops - Analysis,"An Israeli tank has opened fire and killed three Egyptian troops on the sensitive border between the two countries, mistaking them for Palestinian militants on the way to carry out an attack, Israeli media says. This report summarizes recent developments and background context."
1,U.S. Says New Images Show Iran Plans Nuclear Bomb - Analysis," VIENNA (Reuters) - A senior U.S. official said on Thursday  that satellite photographs of a suspected nuclear industrial  site in Iran demonstrated its intention to develop atomic  weapons, an allegation Tehran dismissed as ""a new lie."" This report summarizes recent developments and background context."
